{
	"description": ["Set the value of a DVar locally for a player."],
	"params": [
		{
			"name": "dvar",
			"types": ["string"],
			"description": ["Name of the DVar."]
		},
		{
			"name": "value",
			"types": ["string", "int", "float", "vector"],
			"description": ["Value to set."]
		}
	],
	"receiver": {
		"types": ["player"],
		"description": ["The player on which to set the DVar."]
	},
	"example": ["self setClientDvar(\"cg_drawGun\", 0)"]
}
